{"authorization":"not_established","consumer_execution":"not_observed","continuity_sha256":null,"contract_id":"frozen-03","contract_sha256":"fe27210b5a6f9759e3ff57c2ec70993685ef14d2fef419fa50d8b85a5283068b","files":{"brief.md":"b7b23ef2e695aa33a62a8b7304bb3cb9a5d2fdd51622a85076558dd963729a29","contract.json":"fe27210b5a6f9759e3ff57c2ec70993685ef14d2fef419fa50d8b85a5283068b","history.json":"5a7b291282bf8f795d12cf5d6564a51d5268440f654141dd834408a2b48383fd","inspect_bundle.py":"8f73f536c1af8fa70658fbf7368cf4654da14502544153f33539127c4da66c28","source-S1.txt":"74619d9b72f3031a6385955c65bba5c9821bc71f942922d453d18dfd2bd6afaf","source-manifest.json":"386ec251312d24ea153e3106fcfa9651dc33bfa1c2ea08332162a1ade8ed13d3"},"provenance":{"adoptions":[],"audits":[],"authentication":"unverified"},"record":"intentline.native-handoff","requirement_ids":["R1"],"revision":1,"schema_version":1,"source_bundle_sha256":"386ec251312d24ea153e3106fcfa9651dc33bfa1c2ea08332162a1ade8ed13d3","source_chain_sha256":"c06e1744693bd24c075511e4c005263ba56e5e4fe7107d44995a1291df531135"}
