{"authorization":"not_established","consumer_execution":"not_observed","continuity_sha256":null,"contract_id":"username-validation","contract_sha256":"983effa47fd79dbefd9e26814af7affc661caaa1d0c1dd2bbe3e4f30c255861b","files":{"brief.md":"3419d4a9c9b17c9e68ec416c28298d5dbc64e4049bfe6ffa73bcfa4013db96c7","contract.json":"983effa47fd79dbefd9e26814af7affc661caaa1d0c1dd2bbe3e4f30c255861b","history.json":"9b45a0b7f9b1911489cbd98ac05376d863e3af61e139ceb21cddf4215a79e6f4","inspect_bundle.py":"e7e067ae8fbe5e8ef9f3932f38c73fe57879a04035c8cc8a64617c7644ef2381","source-S1.txt":"54962ec5ec269555068401d68869d652bbb6545333250593b07424bc6ba6241d","source-manifest.json":"15df00ccc974cf497ccf4ca74c4166972c39d45033be089387fecc6f0a262c9a"},"provenance":{"adoptions":[],"audits":[],"authentication":"unverified"},"record":"intentline.native-handoff","requirement_ids":["R1","R2"],"revision":1,"schema_version":1,"source_bundle_sha256":"15df00ccc974cf497ccf4ca74c4166972c39d45033be089387fecc6f0a262c9a","source_chain_sha256":"5937cd28651bd76ba49dd1fe0081fbf640e412c3ae2dca53d18f6e4f6cd86f07"}
